{
  "schema": "nexus-s5-post-stage-analysis-v2",
  "student_id": "eleve-synthetique-test",
  "student_name": "ELEVE SYNTHETIQUE",
  "level_key": "4e",
  "subject": "Mathématiques",
  "analysed_on": "2026-08-28",
  "status": "analysed",
  "scoring_model": "par critère : chaque critère porte une compétence unique",
  "baseline_measure_available": false,
  "score": {
    "total_points": 12.0,
    "max_points": 20,
    "note_sur_20": 12.0,
    "success_rate": 0.6,
    "by_part": {
      "A": {
        "points": 4.0,
        "max_points": 6,
        "success_rate": 0.6667
      },
      "B": {
        "points": 5.0,
        "max_points": 8,
        "success_rate": 0.625
      },
      "C": {
        "points": 3.0,
        "max_points": 6,
        "success_rate": 0.5
      }
    },
    "common_core_points": 10.0,
    "individual_points": 2.0
  },
  "items": [
    {
      "item_id": "4E_ELEVE_SYNTHETIQUE_A1",
      "ref": "A1",
      "part": "A",
      "kind": "commun",
      "skill_id": "M4E_REL_01",
      "skills": [
        "M4E_REL_01"
      ],
      "difficulty": "socle",
      "task_type": "automatisme",
      "points": 1.0,
      "max_points": 1,
      "success_rate": 1.0,
      "criteria": [
        {
          "criterion_id": "4E_ELEVE_SYNTHETIQUE_A1_c1",
          "skill_id": "M4E_REL_01",
          "evidence_type": "automatisme",
          "points": 1.0,
          "max_points": 1
        }
      ],
      "error_codes": [],
      "confidence": null,
      "comparison_status": "indicative_skill_comparison"
    },
    {
      "item_id": "4E_ELEVE_SYNTHETIQUE_A2",
      "ref": "A2",
      "part": "A",
      "kind": "commun",
      "skill_id": "M4E_FRAC_02",
      "skills": [
        "M4E_FRAC_02"
      ],
      "difficulty": "socle",
      "task_type": "automatisme",
      "points": 1.0,
      "max_points": 1,
      "success_rate": 1.0,
      "criteria": [
        {
          "criterion_id": "4E_ELEVE_SYNTHETIQUE_A2_c1",
          "skill_id": "M4E_FRAC_02",
          "evidence_type": "automatisme",
          "points": 1.0,
          "max_points": 1
        }
      ],
      "error_codes": [],
      "confidence": null,
      "comparison_status": "indicative_skill_comparison"
    },
    {
      "item_id": "4E_ELEVE_SYNTHETIQUE_A3",
      "ref": "A3",
      "part": "A",
      "kind": "commun",
      "skill_id": "M4E_LIT_02",
      "skills": [
        "M4E_LIT_02"
      ],
      "difficulty": "socle",
      "task_type": "automatisme",
      "points": 1.0,
      "max_points": 1,
      "success_rate": 1.0,
      "criteria": [
        {
          "criterion_id": "4E_ELEVE_SYNTHETIQUE_A3_c1",
          "skill_id": "M4E_LIT_02",
          "evidence_type": "automatisme",
          "points": 1.0,
          "max_points": 1
        }
      ],
      "error_codes": [],
      "confidence": null,
      "comparison_status": "indicative_skill_comparison"
    },
    {
      "item_id": "4E_ELEVE_SYNTHETIQUE_A4",
      "ref": "A4",
      "part": "A",
      "kind": "commun",
      "skill_id": "M4E_GEO_01",
      "skills": [
        "M4E_GEO_01"
      ],
      "difficulty": "socle",
      "task_type": "automatisme",
      "points": 0.0,
      "max_points": 1,
      "success_rate": 0.0,
      "criteria": [
        {
          "criterion_id": "4E_ELEVE_SYNTHETIQUE_A4_c1",
          "skill_id": "M4E_GEO_01",
          "evidence_type": "automatisme",
          "points": 0.0,
          "max_points": 1
        }
      ],
      "error_codes": [
        "METHODE"
      ],
      "confidence": null,
      "comparison_status": "indicative_skill_comparison"
    },
    {
      "item_id": "4E_ELEVE_SYNTHETIQUE_A5",
      "ref": "A5",
      "part": "A",
      "kind": "individuel",
      "skill_id": "M4E_REL_02",
      "skills": [
        "M4E_REL_02"
      ],
      "difficulty": "socle",
      "task_type": "automatisme",
      "points": 1.0,
      "max_points": 1,
      "success_rate": 1.0,
      "criteria": [
        {
          "criterion_id": "4E_ELEVE_SYNTHETIQUE_A5_c1",
          "skill_id": "M4E_REL_02",
          "evidence_type": "procedure",
          "points": 1.0,
          "max_points": 1
        }
      ],
      "error_codes": [],
      "confidence": null,
      "comparison_status": "indicative_skill_comparison"
    },
    {
      "item_id": "4E_ELEVE_SYNTHETIQUE_A6",
      "ref": "A6",
      "part": "A",
      "kind": "individuel",
      "skill_id": "M4E_FRAC_02",
      "skills": [
        "M4E_FRAC_02"
      ],
      "difficulty": "socle",
      "task_type": "automatisme",
      "points": 0.0,
      "max_points": 1,
      "success_rate": 0.0,
      "criteria": [
        {
          "criterion_id": "4E_ELEVE_SYNTHETIQUE_A6_c1",
          "skill_id": "M4E_FRAC_02",
          "evidence_type": "procedure",
          "points": 0.0,
          "max_points": 1
        }
      ],
      "error_codes": [
        "CONCEPT"
      ],
      "confidence": null,
      "comparison_status": "indicative_skill_comparison"
    },
    {
      "item_id": "4E_ELEVE_SYNTHETIQUE_B1",
      "ref": "B1",
      "part": "B",
      "kind": "commun",
      "skill_id": "M4E_AIRE_01",
      "skills": [
        "M4E_AIRE_01",
        "M4E_PROP_01"
      ],
      "difficulty": "standard",
      "task_type": "application",
      "points": 2.0,
      "max_points": 2,
      "success_rate": 1.0,
      "criteria": [
        {
          "criterion_id": "4E_ELEVE_SYNTHETIQUE_B1_c1",
          "skill_id": "M4E_AIRE_01",
          "evidence_type": "procedure",
          "points": 1.0,
          "max_points": 1.0
        },
        {
          "criterion_id": "4E_ELEVE_SYNTHETIQUE_B1_c2",
          "skill_id": "M4E_PROP_01",
          "evidence_type": "procedure",
          "points": 1.0,
          "max_points": 1.0
        }
      ],
      "error_codes": [],
      "confidence": null,
      "comparison_status": "indicative_skill_comparison"
    },
    {
      "item_id": "4E_ELEVE_SYNTHETIQUE_B2",
      "ref": "B2",
      "part": "B",
      "kind": "commun",
      "skill_id": "M4E_LIT_01",
      "skills": [
        "M4E_LIT_01",
        "M4E_LIT_02"
      ],
      "difficulty": "standard",
      "task_type": "application",
      "points": 0.0,
      "max_points": 2,
      "success_rate": 0.0,
      "criteria": [
        {
          "criterion_id": "4E_ELEVE_SYNTHETIQUE_B2_c1",
          "skill_id": "M4E_LIT_01",
          "evidence_type": "procedure",
          "points": 0.0,
          "max_points": 0.5
        },
        {
          "criterion_id": "4E_ELEVE_SYNTHETIQUE_B2_c2",
          "skill_id": "M4E_LIT_02",
          "evidence_type": "procedure",
          "points": 0.0,
          "max_points": 0.5
        },
        {
          "criterion_id": "4E_ELEVE_SYNTHETIQUE_B2_c3",
          "skill_id": "M4E_LIT_02",
          "evidence_type": "controle",
          "points": 0.0,
          "max_points": 1.0
        }
      ],
      "error_codes": [
        "CONCEPT"
      ],
      "confidence": 4,
      "comparison_status": "indicative_skill_comparison"
    },
    {
      "item_id": "4E_ELEVE_SYNTHETIQUE_B3",
      "ref": "B3",
      "part": "B",
      "kind": "commun",
      "skill_id": "M4E_STAT_01",
      "skills": [
        "M4E_PROP_02",
        "M4E_STAT_01"
      ],
      "difficulty": "standard",
      "task_type": "application",
      "points": 2.0,
      "max_points": 2,
      "success_rate": 1.0,
      "criteria": [
        {
          "criterion_id": "4E_ELEVE_SYNTHETIQUE_B3_c1",
          "skill_id": "M4E_PROP_02",
          "evidence_type": "procedure",
          "points": 1.0,
          "max_points": 1.0
        },
        {
          "criterion_id": "4E_ELEVE_SYNTHETIQUE_B3_c2",
          "skill_id": "M4E_STAT_01",
          "evidence_type": "procedure",
          "points": 0.7,
          "max_points": 0.7
        },
        {
          "criterion_id": "4E_ELEVE_SYNTHETIQUE_B3_c3",
          "skill_id": "M4E_STAT_01",
          "evidence_type": "controle",
          "points": 0.3,
          "max_points": 0.3
        }
      ],
      "error_codes": [],
      "confidence": null,
      "comparison_status": "indicative_skill_comparison"
    },
    {
      "item_id": "4E_ELEVE_SYNTHETIQUE_B4",
      "ref": "B4",
      "part": "B",
      "kind": "individuel",
      "skill_id": "M4E_GEO_02",
      "skills": [
        "M4E_GEO_02"
      ],
      "difficulty": "standard",
      "task_type": "application",
      "points": 1.0,
      "max_points": 2,
      "success_rate": 0.5,
      "criteria": [
        {
          "criterion_id": "4E_ELEVE_SYNTHETIQUE_B4_c1",
          "skill_id": "M4E_GEO_02",
          "evidence_type": "procedure",
          "points": 1.0,
          "max_points": 2
        }
      ],
      "error_codes": [
        "JUSTIFICATION"
      ],
      "confidence": null,
      "comparison_status": "indicative_skill_comparison"
    },
    {
      "item_id": "4E_ELEVE_SYNTHETIQUE_C1",
      "ref": "C1",
      "part": "C",
      "kind": "commun",
      "skill_id": "M4E_AIRE_01",
      "skills": [
        "M4E_AIRE_01",
        "M4E_FRAC_02",
        "M4E_LIT_01"
      ],
      "difficulty": "transfert",
      "task_type": "transfert",
      "points": 3.0,
      "max_points": 4,
      "success_rate": 0.75,
      "criteria": [
        {
          "criterion_id": "4E_ELEVE_SYNTHETIQUE_C1_c1",
          "skill_id": "M4E_AIRE_01",
          "evidence_type": "transfert",
          "points": 1.0,
          "max_points": 1.0
        },
        {
          "criterion_id": "4E_ELEVE_SYNTHETIQUE_C1_c2",
          "skill_id": "M4E_FRAC_02",
          "evidence_type": "procedure",
          "points": 0.5,
          "max_points": 0.5
        },
        {
          "criterion_id": "4E_ELEVE_SYNTHETIQUE_C1_c3",
          "skill_id": "M4E_LIT_01",
          "evidence_type": "transfert",
          "points": 1.5,
          "max_points": 1.5
        },
        {
          "criterion_id": "4E_ELEVE_SYNTHETIQUE_C1_c4",
          "skill_id": "M4E_LIT_01",